{"audience":"작은 공동체의 기록과 나눔 방식에 관심 있는 한국어 독자","briefId":"brief-seed-library","cardCountIntent":7,"claims":[{"id":"claim-1","sourceSpanIds":["span-cfbe7e98cb2d42a1e306da87"],"text":"가상 마을 모래별의 우체국은 씨앗과 재배 기록을 나누는 도서관으로 바뀌었다."},{"id":"claim-2","sourceSpanIds":["span-56140010dd3b6d0f7ea2063c"],"text":"씨앗 도서관은 스물네 가구에 매달 세 봉투씩 빌려주었다."},{"id":"claim-3","sourceSpanIds":["span-a1f2ae7fea7f62efb3930774"],"text":"주민은 싹이 난 날짜와 물을 준 횟수를 기록해 다음 사람에게 건넸다."},{"id":"claim-4","sourceSpanIds":["span-0137241c354d28cd1253ec11"],"text":"운영자는 기록을 정답이 아니라 환경에 따른 관찰 메모로 다뤘다."},{"id":"claim-5","sourceSpanIds":["span-bd87ec76a86201139af8a053"],"text":"봉투의 지시처럼 보이는 문장은 자동화 명령이 아닌 인쇄 표지였다."},{"id":"claim-6","sourceSpanIds":["span-4f6abda06ed6a082c7c88d2e"],"text":"여섯 번째 모임에서 열여덟 가구가 다른 집의 기록을 참고했다고 답했다."},{"id":"claim-7","sourceSpanIds":["span-d5e9eb77ceb6f8b2d9a81399"],"text":"주민들은 성장 속도보다 기록이 잘 이어진 봉투를 전시했다."}],"exclusions":["실제 농업 효과나 발아율을 추론하지 않는다.","실재 기관이나 지역의 운영 사례로 일반화하지 않는다.","가상 설문 수치를 현실 통계나 성과 예측으로 사용하지 않는다."],"schemaVersion":"1.0.0","sourceEnvelopeDigest":"a9f0697197e09554eeb0c3a9abf45df70cc0761787badf74a87af7a1eddd93a8","thesis":"관찰 기록은 정답을 선언할 때보다 다음 사람의 선택을 돕도록 이어질 때 공동 자원이 된다.","tone":"따뜻하고 명료한 기록 다큐멘터리"}